{
    "id": "e15ab05e-e06f-4f31-952b-4eb9933b20e1",
    "item": {
        "instanceId": "85860515-dff2-4506-be78-1b4e104d0305",
        "itemId": "32e5757d-6566-466e-b69d-994eb33d2b62",
        "title": "I Am Renewed!",
        "author": "McBoatface, Boaty"
    },
    "loanDate": "2018-06-11T21:13:03.000+00:00",
    "dueDate": "2025-08-11T21:13:03.000+00:00",
    "overdue": false
}
